A1: 23/06/2023 18:00 | D1: 张数 | E1: 合计 | H1: pb | I1: vm | J1: poster | K1: qr | L1: 不运回 | M1: 裸专 | N1: 灿吧特典 | O1: 平台特典
A2: K4 | B2: 裸专 | C2: pb ver. | D2: 1854 | E2: =SUM(D2:D13) -> 15316 | H2: =D2+D6+D10+D14+D18+D19+D23+D27+D28+D29+D30+D31+D32+D33 -> 5941 | I2: =D3+D7+D11+D15+D20+D24 -> 2946 | J2: =D4+D8+D12+D16+D21+D25 -> 6143 | K2: =D5+D9+D13+D17+D22+D26 -> 4804 | L2: =SUM(D6:D9)+SUM(D23:D26) -> 318 | M2: =SUM(D2:D5)+SUM(D14:D17) -> 12362 | N2: =SUM(D10:D13)+SUM(D19:D22) -> 6030 | O2: =SUM(D27:D33)+D18 -> 1124
C3: vm ver. | D3: 974
C4: poster ver. | D4: 4392
C5: 7QR ver. | D5: 3385
B6: 拆卡 | C6: pb ver. | D6: 11
C7: vm ver. | D7: 12
C8: poster ver. | D8: 67
C9: 7QR ver. | D9: 0
B10: 灿吧特典（运回） | C10: pb ver. | D10: 1867
C11: vm ver. | D11: 1206
C12: poster ver. | D12: 854
C13: 7QR ver. | D13: 694
A14: 星河集美 | B14: 裸专 | C14: pb ver. | D14: 635 | E14: =SUM(D14:D18) -> 1946
C15: vm ver. | D15: 311
C16: poster ver. | D16: 408
C17: 7QR ver. | D17: 403
B18: 平台特典 | C18: pb ver. | D18: 189
A19: 微店 | B19: 灿吧特典（运回） | C19: pb ver. | D19: 429 | E19: =SUM(D19:D28) -> 1711
C20: vm ver. | D20: 421
C21: poster ver. | D21: 307
C22: 7QR ver. | D22: 252
B23: 不运回 | C23: pb ver. | D23: 21
C24: vm ver. | D24: 22
C25: poster ver. | D25: 115
C26: 7QR ver. | D26: 70
B27: 平台特典 | C27: pb ver. | D27: 35
C28: pb ver. | D28: 39
A29: Yeti | B29: 平台特典 | C29: pb ver. | D29: 20 | E29: =D29+D30 -> 54
C30: pb ver. | D30: 34
A31: 熊宝 | B31: 平台特典 | C31: pb ver. | D31: 200 | E31: =SUM(D31:D32) -> 400
C32: pb ver. | D32: 200
A33: Makestar | B33: 平台特典 | C33: pb ver. | D33: 407 | E33: =D33 -> 407
A34: 总计 | B34: =SUM(E2:E33) -> 19834