A1: 20/06/2023 18:00 | D1: 套数 | E1: 张数 | F1: 合计 | I1: 销售额 | J1: total | L1: pb | M1: vm | N1: poster | O1: qr | P1: 不运回 | Q1: 裸专 | R1: 灿吧特典 | S1: 平台特典
A2: K4 | B2: 裸专 | C2: pb ver. | D2: 723 | E2: =D2 -> 723 | F2: =SUM(E2:E22) -> 12060 | H2: 69.5 | I2: =H2*E2 -> 50248.5 | J2: =SUM(I2:I22) -> 653471 | L2: =E2+E6+E15+E19+E23+E29+E33+E37+E45+E11+E41+E49 -> 3107 | M2: =E3+E16+E20+E24+E30+E34+E38++E46+E12+E42+E50 -> 1975 | N2: =E4+E7+E9+E17+E21+E25+E27+E31+E35+E39+E47+E13+E43+E51 -> 4902 | O2: =E5+E8+E10+E18+E22+E26+E28+E32+E36+E40+E48+E14+E44+E52 -> 4003 | P2: =SUM(E11:E14)+SUM(E41:E44)+SUM(E49:E52) -> 155 | Q2: =SUM(E2:E10)+SUM(E23:E36) -> 10646 | R2: =SUM(E15:E22)+SUM(E37:E40)+SUM(E45:E48) -> 3186 | S2: 0
C3: vm ver. | D3: 779 | E3: =D3 -> 779 | H3: 75.5 | I3: =H3*E3 -> 58814.5 | L3: =SUM(L2:O2) -> 13987 | P3: =SUM(P2:S2) -> 13987
C4: poster ver. | D4: 425 | E4: =D4 -> 425 | H4: 49.5 | I4: =H4*E4 -> 21037.5 | L4: 3170 | M4: 1975 | N4: 4902 | O4: 4003 | P4: 155 | Q4: 10646 | R4: 3186 | S4: 0
C5: 7QR ver. | D5: 333 | E5: =D5 -> 333 | H5: 40 | I5: =H5*E5 -> 13320
C6: 2 x pb ver. | D6: 310 | E6: =2*D6 -> 620 | H6: 69.5 | I6: =H6*E6 -> 43090
C7: 7 x poster ver. | D7: 68 | E7: =7*D7 -> 476 | H7: 49.5 | I7: =H7*E7 -> 23562
C8: 7 x 7QR ver. | D8: 76 | E8: =7*D8 -> 532 | H8: 40 | I8: =H8*E8 -> 21280
C9: 指定poster ver. | D9: 3006 | E9: =D9 -> 3006 | H9: 49.5 | I9: =H9*E9 -> 148797
C10: 指定7QR ver. | D10: 2217 | E10: =D10 -> 2217 | H10: 40 | I10: =H10*E10 -> 88680
B11: 拆卡 | C11: pb ver. | D11: 11 | E11: =D11 -> 11 | H11: 68.5 | I11: =H11*E11 -> 753.5
C12: vm ver. | D12: 11 | E12: =D12 -> 11 | H12: 74.5 | I12: =H12*E12 -> 819.5
C13: poster ver. | D13: 66 | E13: =D13 -> 66 | H13: 48.5 | I13: =H13*E13 -> 3201
C14: 7QR ver. | D14: 0 | E14: =D14 -> 0 | H14: 40 | I14: =H14*E14 -> 0
B15: 提前特典补专 | C15: pb ver. | D15: 1095 | E15: =D15 -> 1095 | H15: 69.5 | I15: =H15*E15 -> 76102.5
C16: vm ver. | D16: 798 | E16: =D16 -> 798 | H16: 75.5 | I16: =H16*E16 -> 60249
C17: poster ver. | D17: 496 | E17: =D17 -> 496 | H17: 49.5 | I17: =H17*E17 -> 24552
C18: 7QR ver. | D18: 466 | E18: =D18 -> 466 | H18: 40 | I18: =H18*E18 -> 18640
B19: 眼镜特典 | C19: pb ver. | D19: 1 | E19: =D19 -> 1 | H19: 69.5 | I19: =H19*E19 -> 69.5
C20: vm ver. | D20: 1 | E20: =D20 -> 1 | H20: 75.5 | I20: =H20*E20 -> 75.5
C21: poster ver. | D21: 2 | E21: =D21 -> 2 | H21: 49.5 | I21: =H21*E21 -> 99
C22: 7QR ver. | D22: 2 | E22: =D22 -> 2 | H22: 40 | I22: =H22*E22 -> 80
A23: 星河集美 | B23: 裸专 | C23: pb ver. | D23: 23 | E23: =D23 -> 23 | F23: =SUM(E23:E36) -> 1535 | H23: 69 | I23: =H23*E23 -> 1587 | J23: =SUM(I23:I36) -> 93502
C24: vm ver. | D24: 3 | E24: =D24 -> 3 | H24: 74.5 | I24: =H24*E24 -> 223.5
C25: poster ver. | D25: 0 | E25: =D25 -> 0 | H25: 49 | I25: =H25*E25 -> 0
C26: 7QR ver. | D26: 14 | E26: =D26 -> 14 | H26: 49 | I26: =H26*E26 -> 686
C27: 指定poster ver. | D27: 52 | E27: =D27 -> 52 | H27: 49 | I27: =H27*E27 -> 2548
C28: 指定7QR ver. | D28: 40 | E28: =D28 -> 40 | H28: 49 | I28: =H28*E28 -> 1960
B29: 一键毕业小全套 | C29: 2 x pb ver. | D29: 267 | E29: =2*D29 -> 534 | H29: 310.5 | I29: =H29*D29 -> 82903.5
C30: vm ver. | E30: =D29 -> 267
C31: poster ver. | E31: =D29 -> 267
C32: 7QR ver. | E32: =D29 -> 267
B33: 一键毕业大全套 | C33: 2 x pb ver. | D33: 4 | E33: =2*D33 -> 8 | H33: 898.5 | I33: =H33*D33 -> 3594
C34: vm ver. | E34: =D33 -> 4
C35: 7 x poster ver. | E35: =7*D33 -> 28
C36: 7 x 7QR ver. | E36: =7*D33 -> 28
A37: 微店 | B37: 提前特典补专（运回） | C37: pb ver. | D37: =14+5+11+16+10+6 -> 62 | E37: =D37 -> 62 | F37: =SUM(E37:E52) -> 392 | H37: 70 | I37: =H37*E37 -> 4340 | J37: =SUM(I37:I52) -> 24337
C38: vm ver. | D38: =11+8+13+14+33+6 -> 85 | E38: =D38 -> 85 | H38: 76 | I38: =H38*E38 -> 6460
C39: poster ver. | D39: =4+3+6+11+18+3 -> 45 | E39: =D39 -> 45 | H39: 50 | I39: =H39*E39 -> 2250
C40: 7QR ver. | D40: =14+5+11+16+10+6 -> 62 | E40: =D40 -> 62 | H40: 50.5 | I40: =H40*E40 -> 3131
B41: 提前特典补专（拆卡） | C41: pb ver. | D41: =0+0+0+4+2+0 -> 6 | E41: =D41 -> 6 | H41: 69 | I41: =H41*E41 -> 414
C42: vm ver. | D42: =1+0+1+0+4+0 -> 6 | E42: =D42 -> 6 | H42: 75 | I42: =H42*E42 -> 450
C43: poster ver. | D43: =1+3+4+2+7+0 -> 17 | E43: =D43 -> 17 | H43: 49 | I43: =H43*E43 -> 833
C44: 7QR ver. | D44: =2+1+4+0+13+0 -> 20 | E44: =D44 -> 20 | H44: 49.5 | I44: =H44*E44 -> 990
B45: 眼镜特典（运回） | C45: pb ver. | D45: =20+1 -> 21 | E45: =D45 -> 21 | H45: 70 | I45: =H45*E45 -> 1470
C46: vm ver. | D46: =16+4 -> 20 | E46: =D46 -> 20 | H46: 76 | I46: =H46*E46 -> 1520
C47: poster ver. | D47: =11+0 -> 11 | E47: =D47 -> 11 | H47: 50 | I47: =H47*E47 -> 550
C48: 7QR ver. | D48: =12+7 -> 19 | E48: =D48 -> 19 | H48: 50.5 | I48: =H48*E48 -> 959.5
B49: 眼镜特典（拆卡） | C49: pb ver. | D49: =2+1 -> 3 | E49: =D49 -> 3 | H49: 69 | I49: =H49*E49 -> 207
C50: vm ver. | D50: =1+0 -> 1 | E50: =D50 -> 1 | H50: 75 | I50: =H50*E50 -> 75
C51: poster ver. | D51: =10+1 -> 11 | E51: =D51 -> 11 | H51: 49 | I51: =H51*E51 -> 539
C52: 7QR ver. | D52: =3+0 -> 3 | E52: =D52 -> 3 | H52: 49.5 | I52: =H52*E52 -> 148.5
A53: 总计 | B53: =SUM(F2:F52) -> 13987 | H53: =SUM(J2:J52) -> 771310
A56: 21/06/2023 18:00 | D56: 套数 | E56: 张数 | F56: 合计 | H56: 售价 | I56: 销售额 | J56: total | L56: pb | M56: vm | N56: poster | O56: qr | P56: 不运回 | Q56: 裸专 | R56: 灿吧特典 | S56: 平台特典
A57: K4 | B57: 裸专 | C57: pb ver. | D57: 861 | E57: =D57 -> 861 | F57: =SUM(E57:E77) -> 13831 | H57: 69.5 | I57: =H57*E57 -> 59839.5 | J57: =SUM(I57:I77) -> 760881.5 | L57: =E57+E61+E66+E70+E74+E78+E84+E88+E92+E93+E94+E98+E102+E106+E110+E111+E112+E113 -> 4601 | M57: =E58+E67+E71+E75+E79+E85+E89+E95+E99+E103+E107 -> 2544 | N57: =E59+E62+E64+E68+E72+E76+E80+E82+E86+E90+E96+E100+E104+E108 -> 5489 | O57: =E60+E63+E65+E69+E73+E77+E81+E83+E87+E91+E97+E101+E105+E109 -> 4469 | P57: =SUM(E66:E69)+SUM(E98:E101)+SUM(E106:E109) -> 234 | Q57: =SUM(E57:E65)+SUM(E78:E91) -> 11491 | R57: =SUM(E70:E77)+SUM(E94:E97)+SUM(E102:E105) -> 4818 | S57: =SUM(E92:E93)+SUM(E110:E113) -> 560
C58: vm ver. | D58: 869 | E58: =D58 -> 869 | H58: 75.5 | I58: =H58*E58 -> 65609.5 | L58: =SUM(L57:O57) -> 17103 | P58: =SUM(P57:S57) -> 17103
C59: poster ver. | D59: 453 | E59: =D59 -> 453 | H59: 49.5 | I59: =H59*E59 -> 22423.5 | L59: 4061 | M59: 2544 | N59: 5489 | O59: 4469 | P59: 234 | Q59: 11491 | R59: 4814 | S59: 560
C60: 7QR ver. | D60: 355 | E60: =D60 -> 355 | H60: 40 | I60: =H60*E60 -> 14200
C61: 2 x pb ver. | D61: 348 | E61: =2*D61 -> 696 | H61: 69.5 | I61: =H61*E61 -> 48372
C62: 7 x poster ver. | D62: 70 | E62: =7*D62 -> 490 | H62: 49.5 | I62: =H62*E62 -> 24255
C63: 7 x 7QR ver. | D63: 81 | E63: =7*D63 -> 567 | H63: 40 | I63: =H63*E63 -> 22680
C64: 指定poster ver. | D64: 3162 | E64: =D64 -> 3162 | H64: 49.5 | I64: =H64*E64 -> 156519
C65: 指定7QR ver. | D65: 2358 | E65: =D65 -> 2358 | H65: 40 | I65: =H65*E65 -> 94320
B66: 拆卡 | C66: pb ver. | D66: 11 | E66: =D66 -> 11 | H66: 68.5 | I66: =H66*E66 -> 753.5
C67: vm ver. | D67: 12 | E67: =D67 -> 12 | H67: 74.5 | I67: =H67*E67 -> 894
C68: poster ver. | D68: 67 | E68: =D68 -> 67 | H68: 48.5 | I68: =H68*E68 -> 3249.5
C69: 7QR ver. | D69: 0 | E69: =D69 -> 0 | H69: 40 | I69: =H69*E69 -> 0
B70: 提前特典补专 | C70: pb ver. | D70: 1444 | E70: =D70 -> 1444 | H70: 69.5 | I70: =H70*E70 -> 100358
C71: vm ver. | D71: 970 | E71: =D71 -> 970 | H71: 75.5 | I71: =H71*E71 -> 73235
C72: poster ver. | D72: 622 | E72: =D72 -> 622 | H72: 49.5 | I72: =H72*E72 -> 30789
C73: 7QR ver. | D73: 580 | E73: =D73 -> 580 | H73: 40 | I73: =H73*E73 -> 23200
B74: 眼镜特典 | C74: pb ver. | D74: 113 | E74: =D74 -> 113 | H74: 69.5 | I74: =H74*E74 -> 7853.5
C75: vm ver. | D75: 104 | E75: =D75 -> 104 | H75: 75.5 | I75: =H75*E75 -> 7852
C76: poster ver. | D76: 63 | E76: =D76 -> 63 | H76: 49.5 | I76: =H76*E76 -> 3118.5
C77: 7QR ver. | D77: 34 | E77: =D77 -> 34 | H77: 40 | I77: =H77*E77 -> 1360
A78: 星河集美 | B78: 裸专 | C78: pb ver. | D78: 24 | E78: =D78 -> 24 | F78: =SUM(E78:E93) -> 1804 | H78: 69 | I78: =H78*E78 -> 1656 | J78: =SUM(I78:I93) -> 110886
C79: vm ver. | D79: 3 | E79: =D79 -> 3 | H79: 74.5 | I79: =H79*E79 -> 223.5
C80: poster ver. | D80: 0 | E80: =D80 -> 0 | H80: 49 | I80: =H80*E80 -> 0
C81: 7QR ver. | D81: 21 | E81: =D81 -> 21 | H81: 49 | I81: =H81*E81 -> 1029
C82: 指定poster ver. | D82: 56 | E82: =D82 -> 56 | H82: 49 | I82: =H82*E82 -> 2744
C83: 指定7QR ver. | D83: 43 | E83: =D83 -> 43 | H83: 49 | I83: =H83*E83 -> 2107
B84: 一键毕业小全套 | C84: 2 x pb ver. | D84: 293 | E84: =2*D84 -> 586 | H84: 310.5 | I84: =H84*D84 -> 90976.5
C85: vm ver. | E85: =D84 -> 293
C86: poster ver. | E86: =D84 -> 293
C87: 7QR ver. | E87: =D84 -> 293
B88: 一键毕业大全套 | C88: 2 x pb ver. | D88: 4 | E88: =2*D88 -> 8 | H88: 898.5 | I88: =H88*D88 -> 3594
C89: vm ver. | E89: =D88 -> 4
C90: 7 x poster ver. | E90: =7*D88 -> 28
C91: 7 x 7QR ver. | E91: =7*D88 -> 28
B92: AM指定 | C92: 指定pb ver. | D92: 96 | E92: =D92 -> 96 | H92: 69 | I92: =H92*E92 -> 6624
C93: pb ver. | D93: 28 | E93: =D93 -> 28 | H93: 69 | I93: =H93*E93 -> 1932
A94: 微店 | B94: 提前特典补专（运回） | C94: pb ver. | D94: =9999*6-9974-9991-9984-9968-9878-9991 -> 208 | E94: =D94 -> 208 | F94: =SUM(E94:E109) -> 1032 | H94: 70 | I94: =H94*E94 -> 14560 | J94: =SUM(I94:I109) -> 65025
C95: vm ver. | D95: =9999*6-9978-9987-9981-9974-9914-9993 -> 167 | E95: =D95 -> 167 | H95: 76 | I95: =H95*E95 -> 12692
C96: poster ver. | D96: =9999*6-9992-9992-9989-9976-9940-9992 -> 113 | E96: =D96 -> 113 | H96: 50 | I96: =H96*E96 -> 5650
C97: 7QR ver. | D97: =9999*6-9986-9994-9995-9980-9949-9996 -> 94 | E97: =D97 -> 94 | H97: 50.5 | I97: =H97*E97 -> 4747
B98: 提前特典补专（拆卡） | C98: pb ver. | D98: =0+0+0+4+6+0 -> 10 | E98: =D98 -> 10 | H98: 69 | I98: =H98*E98 -> 690
C99: vm ver. | D99: =3+2+1+0+5+0 -> 11 | E99: =D99 -> 11 | H99: 75 | I99: =H99*E99 -> 825
C100: poster ver. | D100: =2+3+8+7+11+0 -> 31 | E100: =D100 -> 31 | H100: 49 | I100: =H100*E100 -> 1519
C101: 7QR ver. | D101: =3+3+5+3+19+0 -> 33 | E101: =D101 -> 33 | H101: 49.5 | I101: =H101*E101 -> 1633.5
B102: 眼镜特典（运回） | C102: pb ver. | D102: =9999*2-9929-9994 -> 75 | E102: =D102 -> 75 | H102: 70 | I102: =H102*E102 -> 5250
C103: vm ver. | D103: =9999*2-9905-9986 -> 107 | E103: =D103 -> 107 | H103: 76 | I103: =H103*E103 -> 8132
C104: poster ver. | D104: =9999*2-9933-9994 -> 71 | E104: =D104 -> 71 | H104: 50 | I104: =H104*E104 -> 3550
C105: 7QR ver. | D105: =9999*2-9955-9990 -> 53 | E105: =D105 -> 53 | H105: 50.5 | I105: =H105*E105 -> 2676.5
B106: 眼镜特典（拆卡） | C106: pb ver. | D106: =4+1 -> 5 | E106: =D106 -> 5 | H106: 69 | I106: =H106*E106 -> 345
C107: vm ver. | D107: =3+1 -> 4 | E107: =D107 -> 4 | H107: 75 | I107: =H107*E107 -> 300
C108: poster ver. | D108: =9999-9965+6 -> 40 | E108: =D108 -> 40 | H108: 49 | I108: =H108*E108 -> 1960
C109: 7QR ver. | D109: =8+2 -> 10 | E109: =D109 -> 10 | H109: 49.5 | I109: =H109*E109 -> 495
A110: Yeti | B110: BND指定 | C110: pb ver. | D110: 16 | E110: =D110 -> 16 | F110: =E110+E111 -> 36 | H110: 89 | I110: =H110*E110 -> 1424 | J110: =I110+I111 -> 3184
B111: EL指定 | C111: pb ver. | D111: 20 | E111: =D111 -> 20 | H111: 88 | I111: =H111*E111 -> 1760
A112: 熊宝 | B112: WM指定 | C112: pb ver. | D112: 200 | E112: =D112 -> 200 | F112: =E112+E113 -> 400 | H112: 83 | I112: =H112*E112 -> 16600 | J112: =I112+I113 -> 34200
B113: MK指定 | C113: pb ver. | D113: 200 | E113: =D113 -> 200 | H113: 88 | I113: =H113*E113 -> 17600
B114: BND指定 | C114: pb ver. | D114: NA | E114: =D114 -> NA | H114: 95 | I114: NA
B115: EL指定 | C115: pb ver. | D115: NA | E115: =D115 -> NA | H115: 90 | I115: NA
A116: KMS（KA-RM音像店） | B116: VM一键毕业 | C116: 2 x vm ver. | D116: NA | E116: =D116 -> NA | F116: NA | H116: 170 | I116: NA | J116: NA
B117: PB一键毕业 | C117: 2 x pb ver. | D117: NA | E117: =D117 -> NA | H117: 156 | I117: NA
B118: KMS特典 | C118: pb ver. | D118: NA | E118: =D118 -> NA | H118: 78 | I118: NA
C119: vm ver. | D119: NA | E119: =D119 -> NA | H119: 85 | I119: NA
C120: poster ver. | D120: NA | E120: =D120 -> NA | H120: 55 | I120: NA
C121: 7QR ver. | D121: NA | E121: =D121 -> NA | H121: 56 | I121: NA
B122: KMS指定 | C122: pb ver. | D122: NA | E122: =D122 -> NA | H122: 78 | I122: NA
C123: vm ver. | D123: NA | E123: =D123 -> NA | H123: 85 | I123: NA
A124: 爱豆驿站 | B124: VM一键毕业 | C124: vm ver. | D124: NA | E124: =D124 -> NA | F124: NA | H124: 314 | I124: NA | J124: NA
C125: poster * 2 (1+1) | E125: =D124 -> NA
C126: QR * 2 (1+1) | E126: =D124 -> NA
B127: SW指定 | C127: pb ver. | D127: NA | E127: =D127 -> NA | H127: 72 | I127: NA
A128: 总计 | B128: =F57+F78+F94+F110+F112 -> 17103 | H128: =SUM(J57:J115) -> 974176.5
A131: 22/06/2023 18:00 | D131: 套数 | E131: 张数 | F131: 合计 | H131: 售价 | I131: 销售额 | J131: total | L131: pb | M131: vm | N131: poster | O131: qr | P131: 不运回 | Q131: 裸专 | R131: 灿吧特典 | S131: 平台特典
A132: K4 | B132: 裸专 | C132: pb ver. | D132: 959 | E132: =D132 -> 959 | F132: =SUM(E132:E176) -> 14587 | H132: 69.5 | I132: =H132*E132 -> 66650.5 | J132: =SUM(I132:I176) -> 807357 | L132: =E132+E136+E141+E145+E149+E177+E183+E187+E191+E192+E193+E197+E201+E205+E257+E258+E259+E260+E153+E157+E161+E165+E169+E173+E209+E213+E217+E221+E225+E229+E233+E237+E241+E245+E249+E253 -> 5060 | M132: =E133+E142+E146+E150+E178+E184+E188+E194+E198+E202+E206+E154+E158+E162+E166+E170+E174+E210+E214+E218+E222+E226+E230+E234+E238+E242+E246+E250+E254 -> 2685 | N132: =E134+E137+E139+E143+E147+E151+E179+E181+E185+E189+E195+E199+E203+E207+E155+E159+E163+E167+E171+E175+E211+E215+E219+E223+E227+E231+E235+E239+E243+E247+E251+E255 -> 5877 | O132: =E135+E138+E140+E144+E148+E152+E180+E182+E186+E190+E196+E200+E204+E208+E156+E160+E164+E168+E172+E176+E212+E216+E220+E224+E228+E232+E236+E240+E244+E248+E252+E256 -> 4601 | P132: =SUM(E141:E144)+SUM(E197:E200)+SUM(E205:E208)+SUM(E213:E216)+SUM(E221:E224)+SUM(E229:E232)+SUM(E237:E240)+SUM(E245:E248)+SUM(E253:E256) -> 281 | Q132: =SUM(E132:E140)+SUM(E177:E190) -> 11973 | R132: =SUM(E145:E176)+SUM(E193:E196)+SUM(E201:E204)+SUM(E209:E212)+SUM(E217:E220)+SUM(E225:E228)+SUM(E233:E236)+SUM(E241:E244)+SUM(E249:E252) -> 5361 | S132: =SUM(E191:E192)+SUM(E257:E260) -> 608
C133: vm ver. | D133: 925 | E133: =D133 -> 925 | H133: 75.5 | I133: =H133*E133 -> 69837.5 | L133: =SUM(L132:O132) -> 18223 | P133: =SUM(P132:S132) -> 18223
C134: poster ver. | D134: 477 | E134: =D134 -> 477 | H134: 49.5 | I134: =H134*E134 -> 23611.5 | L134: 5060 | M134: 2685 | N134: 5877 | O134: 4601 | P134: 281 | Q134: 11973 | R134: 5361 | S134: 608
C135: 7QR ver. | D135: 376 | E135: =D135 -> 376 | H135: 40 | I135: =H135*E135 -> 15040
C136: 2 x pb ver. | D136: 373 | E136: =2*D136 -> 746 | H136: 69.5 | I136: =H136*E136 -> 51847
C137: 7 x poster ver. | D137: 81 | E137: =7*D137 -> 567 | H137: 49.5 | I137: =H137*E137 -> 28066.5
C138: 7 x 7QR ver. | D138: 72 | E138: =7*D138 -> 504 | H138: 40 | I138: =H138*E138 -> 20160
C139: 指定poster ver. | D139: 3256 | E139: =D139 -> 3256 | H139: 49.5 | I139: =H139*E139 -> 161172
C140: 指定7QR ver. | D140: 2414 | E140: =D140 -> 2414 | H140: 40 | I140: =H140*E140 -> 96560
B141: 拆卡 | C141: pb ver. | D141: 11 | E141: =D141 -> 11 | H141: 68.5 | I141: =H141*E141 -> 753.5
C142: vm ver. | D142: 12 | E142: =D142 -> 12 | H142: 74.5 | I142: =H142*E142 -> 894
C143: poster ver. | D143: 67 | E143: =D143 -> 67 | H143: 48.5 | I143: =H143*E143 -> 3249.5
C144: 7QR ver. | D144: 0 | E144: =D144 -> 0 | H144: 40 | I144: =H144*E144 -> 0
B145: 提前特典补专 | C145: pb ver. | D145: 1526 | E145: =D145 -> 1526 | H145: 69.5 | I145: =H145*E145 -> 106057
C146: vm ver. | D146: 999 | E146: =D146 -> 999 | H146: 75.5 | I146: =H146*E146 -> 75424.5
C147: poster ver. | D147: 663 | E147: =D147 -> 663 | H147: 49.5 | I147: =H147*E147 -> 32818.5
C148: 7QR ver. | D148: 599 | E148: =D148 -> 599 | H148: 40 | I148: =H148*E148 -> 23960
B149: 眼镜特典 | C149: pb ver. | D149: =152+14 -> 166 | E149: =D149 -> 166 | H149: 69.5 | I149: =H149*E149 -> 11537
C150: vm ver. | D150: =121+16 -> 137 | E150: =D150 -> 137 | H150: 75.5 | I150: =H150*E150 -> 10343.5
C151: poster ver. | D151: =74+7 -> 81 | E151: =D151 -> 81 | H151: 49.5 | I151: =H151*E151 -> 4009.5
C152: 7QR ver. | D152: =35+7 -> 42 | E152: =D152 -> 42 | H152: 40 | I152: =H152*E152 -> 1680
B153: 牛仔卡册 | C153: pb ver. | D153: 1 | E153: =D153 -> 1 | H153: 69.5 | I153: =H153*E153 -> 69.5
C154: vm ver. | D154: 2 | E154: =D154 -> 2 | H154: 75.5 | I154: =H154*E154 -> 151
C155: poster ver. | D155: 4 | E155: =D155 -> 4 | H155: 49.5 | I155: =H155*E155 -> 198
C156: 7QR ver. | D156: 1 | E156: =D156 -> 1 | H156: 40 | I156: =H156*E156 -> 40
B157: 趴趴公仔 | C157: pb ver. | D157: 1 | E157: =D157 -> 1 | H157: 69.5 | I157: =H157*E157 -> 69.5
C158: vm ver. | D158: 2 | E158: =D158 -> 2 | H158: 75.5 | I158: =H158*E158 -> 151
C159: poster ver. | D159: 2 | E159: =D159 -> 2 | H159: 49.5 | I159: =H159*E159 -> 99
C160: 7QR ver. | D160: 1 | E160: =D160 -> 1 | H160: 40 | I160: =H160*E160 -> 40
B161: 美妆特典 | C161: pb ver. | D161: 1 | E161: =D161 -> 1 | H161: 69.5 | I161: =H161*E161 -> 69.5
C162: vm ver. | D162: 0 | E162: =D162 -> 0 | H162: 75.5 | I162: =H162*E162 -> 0
C163: poster ver. | D163: 0 | E163: =D163 -> 0 | H163: 49.5 | I163: =H163*E163 -> 0
C164: 7QR ver. | D164: 0 | E164: =D164 -> 0 | H164: 40 | I164: =H164*E164 -> 0
B165: 语音钥匙扣 | C165: pb ver. | D165: 7 | E165: =D165 -> 7 | H165: 69.5 | I165: =H165*E165 -> 486.5
C166: vm ver. | D166: 3 | E166: =D166 -> 3 | H166: 75.5 | I166: =H166*E166 -> 226.5
C167: poster ver. | D167: 9 | E167: =D167 -> 9 | H167: 49.5 | I167: =H167*E167 -> 445.5
C168: 7QR ver. | D168: 2 | E168: =D168 -> 2 | H168: 40 | I168: =H168*E168 -> 80
B169: 香水特典 | C169: pb ver. | D169: 12 | E169: =D169 -> 12 | H169: 69.5 | I169: =H169*E169 -> 834
C170: vm ver. | D170: 5 | E170: =D170 -> 5 | H170: 75.5 | I170: =H170*E170 -> 377.5
C171: poster ver. | D171: 3 | E171: =D171 -> 3 | H171: 49.5 | I171: =H171*E171 -> 148.5
C172: 7QR ver. | D172: 2 | E172: =D172 -> 2 | H172: 40 | I172: =H172*E172 -> 80
B173: 服饰特典 | C173: pb ver. | D173: 1 | E173: =D173 -> 1 | H173: 69.5 | I173: =H173*E173 -> 69.5
C174: vm ver. | D174: 0 | E174: =D174 -> 0 | H174: 75.5 | I174: =H174*E174 -> 0
C175: poster ver. | D175: 1 | E175: =D175 -> 1 | H175: 49.5 | I175: =H175*E175 -> 49.5
C176: 7QR ver. | D176: 0 | E176: =D176 -> 0 | H176: 40 | I176: =H176*E176 -> 0
A177: 星河集美 | B177: 裸专 | C177: pb ver. | D177: 25 | E177: =D177 -> 25 | F177: =SUM(E177:E192) -> 1915 | H177: 69 | I177: =H177*E177 -> 1725 | J177: =SUM(I177:I192) -> 117785.5
C178: vm ver. | D178: 6 | E178: =D178 -> 6 | H178: 74.5 | I178: =H178*E178 -> 447
C179: poster ver. | D179: 7 | E179: =D179 -> 7 | H179: 49 | I179: =H179*E179 -> 343
C180: 7QR ver. | D180: 21 | E180: =D180 -> 21 | H180: 49 | I180: =H180*E180 -> 1029
C181: 指定poster ver. | D181: 60 | E181: =D181 -> 60 | H181: 49 | I181: =H181*E181 -> 2940
C182: 指定7QR ver. | D182: 45 | E182: =D182 -> 45 | H182: 49 | I182: =H182*E182 -> 2205
B183: 一键毕业小全套 | C183: 2 x pb ver. | D183: 300 | E183: =2*D183 -> 600 | H183: 310.5 | I183: =H183*D183 -> 93150
C184: vm ver. | E184: =D183 -> 300
C185: poster ver. | E185: =D183 -> 300
C186: 7QR ver. | E186: =D183 -> 300
B187: 一键毕业大全套 | C187: 2 x pb ver. | D187: 5 | E187: =2*D187 -> 10 | H187: 898.5 | I187: =H187*D187 -> 4492.5
C188: vm ver. | E188: =D187 -> 5
C189: 7 x poster ver. | E189: =7*D187 -> 35
C190: 7 x 7QR ver. | E190: =7*D187 -> 35
B191: AM指定 | C191: 指定pb ver. | D191: 110 | E191: =D191 -> 110 | H191: 69 | I191: =H191*E191 -> 7590
C192: pb ver. | D192: 56 | E192: =D192 -> 56 | H192: 69 | I192: =H192*E192 -> 3864
A193: 微店 | B193: 提前特典补专（运回） | C193: pb ver. | D193: =9999*6-9970-9990-9978-9957-9858-9990 -> 251 | E193: =D193 -> 251 | F193: =SUM(E193:E256) -> 1279 | H193: 70 | I193: =H193*E193 -> 17570 | J193: =SUM(I193:I256) -> 79122.5
C194: vm ver. | D194: =9999*6-9969-9982-9977-9962-9980-9993 -> 131 | E194: =D194 -> 131 | H194: 76 | I194: =H194*E194 -> 9956
C195: poster ver. | D195: =9999*6-9991-9990-9988-9970-9923-9990 -> 142 | E195: =D195 -> 142 | H195: 50 | I195: =H195*E195 -> 7100
C196: 7QR ver. | D196: =9999*6-9984-9994-9992-9976-9928-9996 -> 124 | E196: =D196 -> 124 | H196: 50.5 | I196: =H196*E196 -> 6262
B197: 提前特典补专（拆卡） | C197: pb ver. | D197: =0+0+0+5+8+0 -> 13 | E197: =D197 -> 13 | H197: 69 | I197: =H197*E197 -> 897
C198: vm ver. | D198: =3+2+1+0+7+0 -> 13 | E198: =D198 -> 13 | H198: 75 | I198: =H198*E198 -> 975
C199: poster ver. | D199: =4+6+9+8+15+0 -> 42 | E199: =D199 -> 42 | H199: 49 | I199: =H199*E199 -> 2058
C200: 7QR ver. | D200: =3+4+5+5+20+0 -> 37 | E200: =D200 -> 37 | H200: 49.5 | I200: =H200*E200 -> 1831.5
B201: 眼镜特典（运回） | C201: pb ver. | D201: =9999*2-9912-9993 -> 93 | E201: =D201 -> 93 | H201: 70 | I201: =H201*E201 -> 6510
C202: vm ver. | D202: =9999*2-9886-9986 -> 126 | E202: =D202 -> 126 | H202: 76 | I202: =H202*E202 -> 9576
C203: poster ver. | D203: =9999*2-9909-9993 -> 96 | E203: =D203 -> 96 | H203: 50 | I203: =H203*E203 -> 4800
C204: 7QR ver. | D204: =9999*2-9938-9988 -> 72 | E204: =D204 -> 72 | H204: 50.5 | I204: =H204*E204 -> 3636
B205: 眼镜特典（拆卡） | C205: pb ver. | D205: =5+1 -> 6 | E205: =D205 -> 6 | H205: 69 | I205: =H205*E205 -> 414
C206: vm ver. | D206: =4+1 -> 5 | E206: =D206 -> 5 | H206: 75 | I206: =H206*E206 -> 375
C207: poster ver. | D207: =9999-9957+8 -> 50 | E207: =D207 -> 50 | H207: 49 | I207: =H207*E207 -> 2450
C208: 7QR ver. | D208: =12+3 -> 15 | E208: =D208 -> 15 | H208: 49.5 | I208: =H208*E208 -> 742.5
B209: 牛仔卡册（运回） | C209: pb ver. | D209: 3 | E209: =D209 -> 3 | H209: 70 | I209: =H209*E209 -> 210
C210: vm ver. | D210: 1 | E210: =D210 -> 1 | H210: 76 | I210: =H210*E210 -> 76
C211: poster ver. | D211: 3 | E211: =D211 -> 3 | H211: 50 | I211: =H211*E211 -> 150
C212: 7QR ver. | D212: 2 | E212: =D212 -> 2 | H212: 50.5 | I212: =H212*E212 -> 101
B213: 牛仔卡册（拆卡） | C213: pb ver. | D213: 0 | E213: =D213 -> 0 | H213: 69 | I213: =H213*E213 -> 0
C214: vm ver. | D214: 0 | E214: =D214 -> 0 | H214: 75 | I214: =H214*E214 -> 0
C215: poster ver. | D215: 0 | E215: =D215 -> 0 | H215: 49 | I215: =H215*E215 -> 0
C216: 7QR ver. | D216: 0 | E216: =D216 -> 0 | H216: 49.5 | I216: =H216*E216 -> 0
B217: 趴趴公仔（运回） | C217: pb ver. | D217: 2 | E217: =D217 -> 2 | H217: 70 | I217: =H217*E217 -> 140
C218: vm ver. | D218: 2 | E218: =D218 -> 2 | H218: 76 | I218: =H218*E218 -> 152
C219: poster ver. | D219: 1 | E219: =D219 -> 1 | H219: 50 | I219: =H219*E219 -> 50
C220: 7QR ver. | D220: 2 | E220: =D220 -> 2 | H220: 50.5 | I220: =H220*E220 -> 101
B221: 趴趴公仔（拆卡） | C221: pb ver. | D221: 0 | E221: =D221 -> 0 | H221: 69 | I221: =H221*E221 -> 0
C222: vm ver. | D222: 0 | E222: =D222 -> 0 | H222: 75 | I222: =H222*E222 -> 0
C223: poster ver. | D223: 1 | E223: =D223 -> 1 | H223: 49 | I223: =H223*E223 -> 49
C224: 7QR ver. | D224: 0 | E224: =D224 -> 0 | H224: 49.5 | I224: =H224*E224 -> 0
B225: 美妆特典（运回） | C225: pb ver. | D225: 0 | E225: =D225 -> 0 | H225: 70 | I225: =H225*E225 -> 0
C226: vm ver. | D226: 0 | E226: =D226 -> 0 | H226: 76 | I226: =H226*E226 -> 0
C227: poster ver. | D227: 1 | E227: =D227 -> 1 | H227: 50 | I227: =H227*E227 -> 50
C228: 7QR ver. | D228: 0 | E228: =D228 -> 0 | H228: 50.5 | I228: =H228*E228 -> 0
B229: 美妆特典（拆卡） | C229: pb ver. | D229: 1 | E229: =D229 -> 1 | H229: 69 | I229: =H229*E229 -> 69
C230: vm ver. | D230: 1 | E230: =D230 -> 1 | H230: 75 | I230: =H230*E230 -> 75
C231: poster ver. | D231: 0 | E231: =D231 -> 0 | H231: 49 | I231: =H231*E231 -> 0
C232: 7QR ver. | D232: 0 | E232: =D232 -> 0 | H232: 49.5 | I232: =H232*E232 -> 0
B233: 语音钥匙扣（运回） | C233: pb ver. | D233: 5 | E233: =D233 -> 5 | H233: 70 | I233: =H233*E233 -> 350
C234: vm ver. | D234: 4 | E234: =D234 -> 4 | H234: 76 | I234: =H234*E234 -> 304
C235: poster ver. | D235: 1 | E235: =D235 -> 1 | H235: 50 | I235: =H235*E235 -> 50
C236: 7QR ver. | D236: 1 | E236: =D236 -> 1 | H236: 50.5 | I236: =H236*E236 -> 50.5
B237: 语音钥匙扣（拆卡） | C237: pb ver. | D237: 0 | E237: =D237 -> 0 | H237: 69 | I237: =H237*E237 -> 0
C238: vm ver. | D238: 0 | E238: =D238 -> 0 | H238: 75 | I238: =H238*E238 -> 0
C239: poster ver. | D239: 2 | E239: =D239 -> 2 | H239: 49 | I239: =H239*E239 -> 98
C240: 7QR ver. | D240: 0 | E240: =D240 -> 0 | H240: 49.5 | I240: =H240*E240 -> 0
B241: 香水特典（运回） | C241: pb ver. | D241: 9 | E241: =D241 -> 9 | H241: 70 | I241: =H241*E241 -> 630
C242: vm ver. | D242: 3 | E242: =D242 -> 3 | H242: 76 | I242: =H242*E242 -> 228
C243: poster ver. | D243: 4 | E243: =D243 -> 4 | H243: 50 | I243: =H243*E243 -> 200
C244: 7QR ver. | D244: 3 | E244: =D244 -> 3 | H244: 50.5 | I244: =H244*E244 -> 151.5
B245: 香水特典（拆卡） | C245: pb ver. | D245: 1 | E245: =D245 -> 1 | H245: 69 | I245: =H245*E245 -> 69
C246: vm ver. | D246: 1 | E246: =D246 -> 1 | H246: 75 | I246: =H246*E246 -> 75
C247: poster ver. | D247: 2 | E247: =D247 -> 2 | H247: 49 | I247: =H247*E247 -> 98
C248: 7QR ver. | D248: 1 | E248: =D248 -> 1 | H248: 49.5 | I248: =H248*E248 -> 49.5
B249: 服饰特典（运回） | C249: pb ver. | D249: 2 | E249: =D249 -> 2 | H249: 70 | I249: =H249*E249 -> 140
C250: vm ver. | D250: 2 | E250: =D250 -> 2 | H250: 76 | I250: =H250*E250 -> 152
C251: poster ver. | D251: 0 | E251: =D251 -> 0 | H251: 50 | I251: =H251*E251 -> 0
C252: 7QR ver. | D252: 2 | E252: =D252 -> 2 | H252: 50.5 | I252: =H252*E252 -> 101
B253: 服饰特典（拆卡） | C253: pb ver. | D253: 0 | E253: =D253 -> 0 | H253: 69 | I253: =H253*E253 -> 0
C254: vm ver. | D254: 0 | E254: =D254 -> 0 | H254: 75 | I254: =H254*E254 -> 0
C255: poster ver. | D255: 0 | E255: =D255 -> 0 | H255: 49 | I255: =H255*E255 -> 0
C256: 7QR ver. | D256: 0 | E256: =D256 -> 0 | H256: 49.5 | I256: =H256*E256 -> 0
A257: Yeti | B257: BND指定 | C257: pb ver. | D257: 18 | E257: =D257 -> 18 | F257: =E257+E258 -> 42 | H257: 89 | I257: =H257*E257 -> 1602 | J257: =I257+I258 -> 3714
B258: EL指定 | C258: pb ver. | D258: 24 | E258: =D258 -> 24 | H258: 88 | I258: =H258*E258 -> 2112
A259: 熊宝 | B259: WM指定 | C259: pb ver. | D259: 200 | E259: =D259 -> 200 | F259: =E259+E260 -> 400 | H259: 83 | I259: =H259*E259 -> 16600 | J259: =I259+I260 -> 34200
B260: MK指定 | C260: pb ver. | D260: 200 | E260: =D260 -> 200 | H260: 88 | I260: =H260*E260 -> 17600
B261: BND指定 | C261: pb ver. | D261: NA | E261: =D261 -> NA | H261: 95 | I261: NA
B262: EL指定 | C262: pb ver. | D262: NA | E262: =D262 -> NA | H262: 90 | I262: NA
B263: interasia指定 | C263: pb ver. | D263: NA | E263: =D263 -> NA | H263: 87 | I263: NA
A264: KMS（KA-RM音像店） | B264: VM一键毕业 | C264: 2 x vm ver. | D264: NA | E264: =D264 -> NA | F264: NA | H264: 170 | I264: NA | J264: NA
B265: PB一键毕业 | C265: 2 x pb ver. | D265: NA | E265: =D265 -> NA | H265: 156 | I265: NA
B266: KMS特典 | C266: pb ver. | D266: NA | E266: =D266 -> NA | H266: 78 | I266: NA
C267: vm ver. | D267: NA | E267: =D267 -> NA | H267: 85 | I267: NA
C268: poster ver. | D268: NA | E268: =D268 -> NA | H268: 55 | I268: NA
C269: 7QR ver. | D269: NA | E269: =D269 -> NA | H269: 56 | I269: NA
B270: KMS指定 | C270: pb ver. | D270: NA | E270: =D270 -> NA | H270: 78 | I270: NA
C271: vm ver. | D271: NA | E271: =D271 -> NA | H271: 85 | I271: NA
A272: 爱豆驿站 | B272: VM一键毕业 | C272: vm ver. | D272: NA | E272: =D272 -> NA | F272: NA | H272: 314 | I272: NA | J272: NA
C273: poster * 2 (1+1) | E273: =D272 -> NA
C274: QR * 2 (1+1) | E274: =D272 -> NA
B275: SW指定 | C275: pb ver. | D275: NA | E275: =D275 -> NA | H275: 72 | I275: NA
B276: MP指定 | C276: pb ver. | D276: NA | E276: =D276 -> NA | H276: 87 | I276: NA
A277: HANTEO(HANTEO CHINA) | B277: HANTEO指定特典 | C277: pb ver. | D277: NA | E277: =D277 -> NA | F277: NA | H277: NA | I277: NA | J277: NA
C278: vm ver. | D278: NA | E278: =D277 -> NA | H278: NA | I278: NA
C279: poster ver. | D279: NA | E279: =D277 -> NA | H279: NA | I279: NA
C280: 7QR ver. | D280: NA | E280: =D280 -> NA | H280: NA | I280: NA
B281: HANTEO一键毕业 | C281: 2 * pb ver. | D281: NA | E281: =D281 -> NA | H281: NA | I281: NA
C282: vm ver. | E282: =D281 -> NA
C283: poster ver. | E283: =D281 -> NA
C284: 7QR ver. | E284: =D281 -> NA
A285: 偶像便利店 | B285: WM指定 | C285: 2 * pb ver. | D285: NA | E285: =D285 -> NA | F285: NA | H285: 161 | I285: NA | J285: NA
B286: SW指定 | C286: 2 * pb ver. | D286: NA | E286: =D285 -> NA | H286: 152 | I286: NA
A287: 总计 | B287: =F132+F177+F193+F257+F259 -> 18223 | H287: =SUM(J132:J262) -> 1042179