A1: 20/06/2023 18:00 | D1: 套数 | E1: 张数 | F1: 合计 | I1: 销售额 | J1: total | L1: pb | M1: vm | N1: poster | O1: qr | P1: 不运回 | Q1: 裸专 | R1: 灿吧特典 | S1: 平台特典
A2: K4 | B2: 裸专 | C2: pb ver. | D2: 723 | E2: =D2 -> 723 | F2: =SUM(E2:E22) -> 12060 | H2: 69.5 | I2: =H2*E2 -> 50248.5 | J2: =SUM(I2:I22) -> 653471 | L2: =E2+E6+E15+E19+E23+E29+E33+E37+E45+E11+E41+E49 -> 3107 | M2: =E3+E16+E20+E24+E30+E34+E38++E46+E12+E42+E50 -> 1975 | N2: =E4+E7+E9+E17+E21+E25+E27+E31+E35+E39+E47+E13+E43+E51 -> 4902 | O2: =E5+E8+E10+E18+E22+E26+E28+E32+E36+E40+E48+E14+E44+E52 -> 4003 | P2: =SUM(E11:E14)+SUM(E41:E44)+SUM(E49:E52) -> 155 | Q2: =SUM(E2:E10)+SUM(E23:E36) -> 10646 | R2: =SUM(E15:E22)+SUM(E37:E40)+SUM(E45:E48) -> 3186 | S2: 0
C3: vm ver. | D3: 779 | E3: =D3 -> 779 | H3: 75.5 | I3: =H3*E3 -> 58814.5 | L3: =SUM(L2:O2) -> 13987 | P3: =SUM(P2:S2) -> 13987
C4: poster ver. | D4: 425 | E4: =D4 -> 425 | H4: 49.5 | I4: =H4*E4 -> 21037.5 | L4: 3170 | M4: 1975 | N4: 4902 | O4: 4003 | P4: 155 | Q4: 10646 | R4: 3186 | S4: 0
C5: 7QR ver. | D5: 333 | E5: =D5 -> 333 | H5: 40 | I5: =H5*E5 -> 13320
C6: 2 x pb ver. | D6: 310 | E6: =2*D6 -> 620 | H6: 69.5 | I6: =H6*E6 -> 43090
C7: 7 x poster ver. | D7: 68 | E7: =7*D7 -> 476 | H7: 49.5 | I7: =H7*E7 -> 23562
C8: 7 x 7QR ver. | D8: 76 | E8: =7*D8 -> 532 | H8: 40 | I8: =H8*E8 -> 21280
C9: 指定poster ver. | D9: 3006 | E9: =D9 -> 3006 | H9: 49.5 | I9: =H9*E9 -> 148797
C10: 指定7QR ver. | D10: 2217 | E10: =D10 -> 2217 | H10: 40 | I10: =H10*E10 -> 88680
B11: 拆卡 | C11: pb ver. | D11: 11 | E11: =D11 -> 11 | H11: 68.5 | I11: =H11*E11 -> 753.5
C12: vm ver. | D12: 11 | E12: =D12 -> 11 | H12: 74.5 | I12: =H12*E12 -> 819.5
C13: poster ver. | D13: 66 | E13: =D13 -> 66 | H13: 48.5 | I13: =H13*E13 -> 3201
C14: 7QR ver. | D14: 0 | E14: =D14 -> 0 | H14: 40 | I14: =H14*E14 -> 0
B15: 提前特典补专 | C15: pb ver. | D15: 1095 | E15: =D15 -> 1095 | H15: 69.5 | I15: =H15*E15 -> 76102.5
C16: vm ver. | D16: 798 | E16: =D16 -> 798 | H16: 75.5 | I16: =H16*E16 -> 60249
C17: poster ver. | D17: 496 | E17: =D17 -> 496 | H17: 49.5 | I17: =H17*E17 -> 24552
C18: 7QR ver. | D18: 466 | E18: =D18 -> 466 | H18: 40 | I18: =H18*E18 -> 18640
B19: 眼镜特典 | C19: pb ver. | D19: 1 | E19: =D19 -> 1 | H19: 69.5 | I19: =H19*E19 -> 69.5
C20: vm ver. | D20: 1 | E20: =D20 -> 1 | H20: 75.5 | I20: =H20*E20 -> 75.5
C21: poster ver. | D21: 2 | E21: =D21 -> 2 | H21: 49.5 | I21: =H21*E21 -> 99
C22: 7QR ver. | D22: 2 | E22: =D22 -> 2 | H22: 40 | I22: =H22*E22 -> 80
A23: 星河集美 | B23: 裸专 | C23: pb ver. | D23: 23 | E23: =D23 -> 23 | F23: =SUM(E23:E36) -> 1535 | H23: 69 | I23: =H23*E23 -> 1587 | J23: =SUM(I23:I36) -> 93502
C24: vm ver. | D24: 3 | E24: =D24 -> 3 | H24: 74.5 | I24: =H24*E24 -> 223.5
C25: poster ver. | D25: 0 | E25: =D25 -> 0 | H25: 49 | I25: =H25*E25 -> 0
C26: 7QR ver. | D26: 14 | E26: =D26 -> 14 | H26: 49 | I26: =H26*E26 -> 686
C27: 指定poster ver. | D27: 52 | E27: =D27 -> 52 | H27: 49 | I27: =H27*E27 -> 2548
C28: 指定7QR ver. | D28: 40 | E28: =D28 -> 40 | H28: 49 | I28: =H28*E28 -> 1960
B29: 一键毕业小全套 | C29: 2 x pb ver. | D29: 267 | E29: =2*D29 -> 534 | H29: 310.5 | I29: =H29*D29 -> 82903.5
C30: vm ver. | E30: =D29 -> 267
C31: poster ver. | E31: =D29 -> 267
C32: 7QR ver. | E32: =D29 -> 267
B33: 一键毕业大全套 | C33: 2 x pb ver. | D33: 4 | E33: =2*D33 -> 8 | H33: 898.5 | I33: =H33*D33 -> 3594
C34: vm ver. | E34: =D33 -> 4
C35: 7 x poster ver. | E35: =7*D33 -> 28
C36: 7 x 7QR ver. | E36: =7*D33 -> 28
A37: 微店 | B37: 提前特典补专（运回） | C37: pb ver. | D37: =14+5+11+16+10+6 -> 62 | E37: =D37 -> 62 | F37: =SUM(E37:E52) -> 392 | H37: 70 | I37: =H37*E37 -> 4340 | J37: =SUM(I37:I52) -> 24337
C38: vm ver. | D38: =11+8+13+14+33+6 -> 85 | E38: =D38 -> 85 | H38: 76 | I38: =H38*E38 -> 6460
C39: poster ver. | D39: =4+3+6+11+18+3 -> 45 | E39: =D39 -> 45 | H39: 50 | I39: =H39*E39 -> 2250
C40: 7QR ver. | D40: =14+5+11+16+10+6 -> 62 | E40: =D40 -> 62 | H40: 50.5 | I40: =H40*E40 -> 3131
B41: 提前特典补专（拆卡） | C41: pb ver. | D41: =0+0+0+4+2+0 -> 6 | E41: =D41 -> 6 | H41: 69 | I41: =H41*E41 -> 414
C42: vm ver. | D42: =1+0+1+0+4+0 -> 6 | E42: =D42 -> 6 | H42: 75 | I42: =H42*E42 -> 450
C43: poster ver. | D43: =1+3+4+2+7+0 -> 17 | E43: =D43 -> 17 | H43: 49 | I43: =H43*E43 -> 833
C44: 7QR ver. | D44: =2+1+4+0+13+0 -> 20 | E44: =D44 -> 20 | H44: 49.5 | I44: =H44*E44 -> 990
B45: 眼镜特典（运回） | C45: pb ver. | D45: =20+1 -> 21 | E45: =D45 -> 21 | H45: 70 | I45: =H45*E45 -> 1470
C46: vm ver. | D46: =16+4 -> 20 | E46: =D46 -> 20 | H46: 76 | I46: =H46*E46 -> 1520
C47: poster ver. | D47: =11+0 -> 11 | E47: =D47 -> 11 | H47: 50 | I47: =H47*E47 -> 550
C48: 7QR ver. | D48: =12+7 -> 19 | E48: =D48 -> 19 | H48: 50.5 | I48: =H48*E48 -> 959.5
B49: 眼镜特典（拆卡） | C49: pb ver. | D49: =2+1 -> 3 | E49: =D49 -> 3 | H49: 69 | I49: =H49*E49 -> 207
C50: vm ver. | D50: =1+0 -> 1 | E50: =D50 -> 1 | H50: 75 | I50: =H50*E50 -> 75
C51: poster ver. | D51: =10+1 -> 11 | E51: =D51 -> 11 | H51: 49 | I51: =H51*E51 -> 539
C52: 7QR ver. | D52: =3+0 -> 3 | E52: =D52 -> 3 | H52: 49.5 | I52: =H52*E52 -> 148.5
A53: 总计 | B53: =SUM(F2:F52) -> 13987 | H53: =SUM(J2:J52) -> 771310
A55: 21/06/2023 18:00 | D55: 套数 | E55: 张数 | F55: 合计 | H55: 售价 | I55: 销售额 | J55: total | L55: pb | M55: vm | N55: poster | O55: qr | P55: 不运回 | Q55: 裸专 | R55: 灿吧特典 | S55: 平台特典
A56: K4 | B56: 裸专 | C56: pb ver. | D56: 861 | E56: =D56 -> 861 | F56: =SUM(E56:E76) -> 13831 | H56: 69.5 | I56: =H56*E56 -> 59839.5 | J56: =SUM(I56:I76) -> 760881.5 | L56: =E56+E60+E65+E69+E73+E77+E83+E87+E91+E92+E93+E97+E101+E105+E109+E110+E111+E112 -> 4601 | M56: =E57+E66+E70+E74+E78+E84+E88+E94+E98+E102+E106 -> 2544 | N56: =E58+E61+E63+E67+E71+E75+E79+E81+E85+E89+E95+E99+E103+E107 -> 5489 | O56: =E59+E62+E64+E68+E72+E76+E80+E82+E86+E90+E96+E100+E104+E108 -> 4469 | P56: =SUM(E65:E68)+SUM(E97:E100)+SUM(E105:E108) -> 234 | Q56: =SUM(E56:E64)+SUM(E77:E90) -> 11491 | R56: =SUM(E69:E76)+SUM(E93:E96)+SUM(E101:E104) -> 4818 | S56: =SUM(E91:E92)+SUM(E109:E112) -> 560
C57: vm ver. | D57: 869 | E57: =D57 -> 869 | H57: 75.5 | I57: =H57*E57 -> 65609.5 | L57: =SUM(L56:O56) -> 17103 | P57: =SUM(P56:S56) -> 17103
C58: poster ver. | D58: 453 | E58: =D58 -> 453 | H58: 49.5 | I58: =H58*E58 -> 22423.5 | L58: 4061 | M58: 2544 | N58: 5489 | O58: 4469 | P58: 234 | Q58: 11491 | R58: 4814 | S58: 560
C59: 7QR ver. | D59: 355 | E59: =D59 -> 355 | H59: 40 | I59: =H59*E59 -> 14200
C60: 2 x pb ver. | D60: 348 | E60: =2*D60 -> 696 | H60: 69.5 | I60: =H60*E60 -> 48372
C61: 7 x poster ver. | D61: 70 | E61: =7*D61 -> 490 | H61: 49.5 | I61: =H61*E61 -> 24255
C62: 7 x 7QR ver. | D62: 81 | E62: =7*D62 -> 567 | H62: 40 | I62: =H62*E62 -> 22680
C63: 指定poster ver. | D63: 3162 | E63: =D63 -> 3162 | H63: 49.5 | I63: =H63*E63 -> 156519
C64: 指定7QR ver. | D64: 2358 | E64: =D64 -> 2358 | H64: 40 | I64: =H64*E64 -> 94320
B65: 拆卡 | C65: pb ver. | D65: 11 | E65: =D65 -> 11 | H65: 68.5 | I65: =H65*E65 -> 753.5
C66: vm ver. | D66: 12 | E66: =D66 -> 12 | H66: 74.5 | I66: =H66*E66 -> 894
C67: poster ver. | D67: 67 | E67: =D67 -> 67 | H67: 48.5 | I67: =H67*E67 -> 3249.5
C68: 7QR ver. | D68: 0 | E68: =D68 -> 0 | H68: 40 | I68: =H68*E68 -> 0
B69: 提前特典补专 | C69: pb ver. | D69: 1444 | E69: =D69 -> 1444 | H69: 69.5 | I69: =H69*E69 -> 100358
C70: vm ver. | D70: 970 | E70: =D70 -> 970 | H70: 75.5 | I70: =H70*E70 -> 73235
C71: poster ver. | D71: 622 | E71: =D71 -> 622 | H71: 49.5 | I71: =H71*E71 -> 30789
C72: 7QR ver. | D72: 580 | E72: =D72 -> 580 | H72: 40 | I72: =H72*E72 -> 23200
B73: 眼镜特典 | C73: pb ver. | D73: 113 | E73: =D73 -> 113 | H73: 69.5 | I73: =H73*E73 -> 7853.5
C74: vm ver. | D74: 104 | E74: =D74 -> 104 | H74: 75.5 | I74: =H74*E74 -> 7852
C75: poster ver. | D75: 63 | E75: =D75 -> 63 | H75: 49.5 | I75: =H75*E75 -> 3118.5
C76: 7QR ver. | D76: 34 | E76: =D76 -> 34 | H76: 40 | I76: =H76*E76 -> 1360
A77: 星河集美 | B77: 裸专 | C77: pb ver. | D77: 24 | E77: =D77 -> 24 | F77: =SUM(E77:E92) -> 1804 | H77: 69 | I77: =H77*E77 -> 1656 | J77: =SUM(I77:I92) -> 110886
C78: vm ver. | D78: 3 | E78: =D78 -> 3 | H78: 74.5 | I78: =H78*E78 -> 223.5
C79: poster ver. | D79: 0 | E79: =D79 -> 0 | H79: 49 | I79: =H79*E79 -> 0
C80: 7QR ver. | D80: 21 | E80: =D80 -> 21 | H80: 49 | I80: =H80*E80 -> 1029
C81: 指定poster ver. | D81: 56 | E81: =D81 -> 56 | H81: 49 | I81: =H81*E81 -> 2744
C82: 指定7QR ver. | D82: 43 | E82: =D82 -> 43 | H82: 49 | I82: =H82*E82 -> 2107
B83: 一键毕业小全套 | C83: 2 x pb ver. | D83: 293 | E83: =2*D83 -> 586 | H83: 310.5 | I83: =H83*D83 -> 90976.5
C84: vm ver. | E84: =D83 -> 293
C85: poster ver. | E85: =D83 -> 293
C86: 7QR ver. | E86: =D83 -> 293
B87: 一键毕业大全套 | C87: 2 x pb ver. | D87: 4 | E87: =2*D87 -> 8 | H87: 898.5 | I87: =H87*D87 -> 3594
C88: vm ver. | E88: =D87 -> 4
C89: 7 x poster ver. | E89: =7*D87 -> 28
C90: 7 x 7QR ver. | E90: =7*D87 -> 28
B91: AM指定 | C91: 指定pb ver. | D91: 96 | E91: =D91 -> 96 | H91: 69 | I91: =H91*E91 -> 6624
C92: pb ver. | D92: 28 | E92: =D92 -> 28 | H92: 69 | I92: =H92*E92 -> 1932
A93: 微店 | B93: 提前特典补专（运回） | C93: pb ver. | D93: =9999*6-9974-9991-9984-9968-9878-9991 -> 208 | E93: =D93 -> 208 | F93: =SUM(E93:E108) -> 1032 | H93: 70 | I93: =H93*E93 -> 14560 | J93: =SUM(I93:I108) -> 65025
C94: vm ver. | D94: =9999*6-9978-9987-9981-9974-9914-9993 -> 167 | E94: =D94 -> 167 | H94: 76 | I94: =H94*E94 -> 12692
C95: poster ver. | D95: =9999*6-9992-9992-9989-9976-9940-9992 -> 113 | E95: =D95 -> 113 | H95: 50 | I95: =H95*E95 -> 5650
C96: 7QR ver. | D96: =9999*6-9986-9994-9995-9980-9949-9996 -> 94 | E96: =D96 -> 94 | H96: 50.5 | I96: =H96*E96 -> 4747
B97: 提前特典补专（拆卡） | C97: pb ver. | D97: =0+0+0+4+6+0 -> 10 | E97: =D97 -> 10 | H97: 69 | I97: =H97*E97 -> 690
C98: vm ver. | D98: =3+2+1+0+5+0 -> 11 | E98: =D98 -> 11 | H98: 75 | I98: =H98*E98 -> 825
C99: poster ver. | D99: =2+3+8+7+11+0 -> 31 | E99: =D99 -> 31 | H99: 49 | I99: =H99*E99 -> 1519
C100: 7QR ver. | D100: =3+3+5+3+19+0 -> 33 | E100: =D100 -> 33 | H100: 49.5 | I100: =H100*E100 -> 1633.5
B101: 眼镜特典（运回） | C101: pb ver. | D101: =9999*2-9929-9994 -> 75 | E101: =D101 -> 75 | H101: 70 | I101: =H101*E101 -> 5250
C102: vm ver. | D102: =9999*2-9905-9986 -> 107 | E102: =D102 -> 107 | H102: 76 | I102: =H102*E102 -> 8132
C103: poster ver. | D103: =9999*2-9933-9994 -> 71 | E103: =D103 -> 71 | H103: 50 | I103: =H103*E103 -> 3550
C104: 7QR ver. | D104: =9999*2-9955-9990 -> 53 | E104: =D104 -> 53 | H104: 50.5 | I104: =H104*E104 -> 2676.5
B105: 眼镜特典（拆卡） | C105: pb ver. | D105: =4+1 -> 5 | E105: =D105 -> 5 | H105: 69 | I105: =H105*E105 -> 345
C106: vm ver. | D106: =3+1 -> 4 | E106: =D106 -> 4 | H106: 75 | I106: =H106*E106 -> 300
C107: poster ver. | D107: =9999-9965+6 -> 40 | E107: =D107 -> 40 | H107: 49 | I107: =H107*E107 -> 1960
C108: 7QR ver. | D108: =8+2 -> 10 | E108: =D108 -> 10 | H108: 49.5 | I108: =H108*E108 -> 495
A109: Yeti | B109: BND指定 | C109: pb ver. | D109: 16 | E109: =D109 -> 16 | F109: =E109+E110 -> 36 | H109: 89 | I109: =H109*E109 -> 1424 | J109: =I109+I110 -> 3184
B110: EL指定 | C110: pb ver. | D110: 20 | E110: =D110 -> 20 | H110: 88 | I110: =H110*E110 -> 1760
A111: 熊宝 | B111: WM指定 | C111: pb ver. | D111: 200 | E111: =D111 -> 200 | F111: =E111+E112 -> 400 | H111: 83 | I111: =H111*E111 -> 16600 | J111: =I111+I112 -> 34200
B112: MK指定 | C112: pb ver. | D112: 200 | E112: =D112 -> 200 | H112: 88 | I112: =H112*E112 -> 17600
B113: BND指定 | C113: pb ver. | D113: NA | E113: =D113 -> NA | H113: 95 | I113: NA
B114: EL指定 | C114: pb ver. | D114: NA | E114: =D114 -> NA | H114: 90 | I114: NA
A115: KMS（KA-RM音像店） | B115: VM一键毕业 | C115: 2 x vm ver. | D115: NA | E115: =D115 -> NA | F115: NA | H115: 170 | I115: NA | J115: NA
B116: PB一键毕业 | C116: 2 x pb ver. | D116: NA | E116: =D116 -> NA | H116: 156 | I116: NA
B117: KMS特典 | C117: pb ver. | D117: NA | E117: =D117 -> NA | H117: 78 | I117: NA
C118: vm ver. | D118: NA | E118: =D118 -> NA | H118: 85 | I118: NA
C119: poster ver. | D119: NA | E119: =D119 -> NA | H119: 55 | I119: NA
C120: 7QR ver. | D120: NA | E120: =D120 -> NA | H120: 56 | I120: NA
B121: KMS指定 | C121: pb ver. | D121: NA | E121: =D121 -> NA | H121: 78 | I121: NA
C122: vm ver. | D122: NA | E122: =D122 -> NA | H122: 85 | I122: NA
A123: 爱豆驿站 | B123: VM一键毕业 | C123: vm ver. | D123: NA | E123: =D123 -> NA | F123: NA | H123: 314 | I123: NA | J123: NA
C124: poster * 2 (1+1) | E124: =D123 -> NA
C125: QR * 2 (1+1) | E125: =D123 -> NA
B126: SW指定 | C126: pb ver. | D126: NA | E126: =D126 -> NA | H126: 72 | I126: NA
A127: 总计 | B127: =F56+F77+F93+F109+F111 -> 17103 | H127: =SUM(J56:J114) -> 974176.5